date,priority,action,reason,status
2026-05-10,high,Проверить shortlist вручную перед сделками.,"Автоматический скоринг учитывает momentum и новости, но не заменяет фундаментальную оценку.",carried_over
2026-05-10,medium,Обновить капитал и еженедельный бюджет в investment_policy.json.,Без этого агент не может рассчитать точные суммы входа.,carried_over
2026-05-11,high,Проверить shortlist вручную перед сделками.,"Автоматический скоринг учитывает momentum и новости, но не заменяет фундаментальную оценку.",open
2026-05-11,medium,Обновить капитал и еженедельный бюджет в investment_policy.json.,Без этого агент не может рассчитать точные суммы входа.,open
2026-05-11,high,Отслеживать нефть и геополитику (risk-off).,"В новостном фоне (CNBC Markets) упоминаются риски эскалации и рост нефти; это может влиять на ставки/инфляцию и риск-аппетит.",open
